"Status","Start Time","Stop Time","Duration in ms","Parent Suite","Suite","Sub Suite","Test Class","Test Method","Name","Description"
"passed","Mon May 13 19:14:25 GMT 2024","Mon May 13 19:14:37 GMT 2024","12098","","","","ProjectTests","AddProjectWithModel","AddProjectWithModel","Verifying a project with model data has been added"
"passed","Mon May 13 19:14:25 GMT 2024","Mon May 13 19:14:34 GMT 2024","8999","","","","LoginTests","LoginWithoutUserNameAndPassword","LoginWithoutUserNameAndPassword","Check the error messages if username and password are not entered"
"passed","Mon May 13 19:14:34 GMT 2024","Mon May 13 19:14:37 GMT 2024","2719","","","","LoginTests","LoginWithWrongUserNameAndPassword","LoginWithWrongUserNameAndPassword","Check the error messages if username and password are incorrect"
"passed","Mon May 13 19:14:25 GMT 2024","Mon May 13 19:14:38 GMT 2024","13023","","","","ProjectTests","AddProjectWithNameAndType","AddProjectWithNameAndType","Verifying a project with name and type has been added"
"passed","Mon May 13 19:14:34 GMT 2024","Mon May 13 19:14:38 GMT 2024","3521","","","","LoginTests","PositiveLogin","PositiveLogin","Check login with the correct username and password"
"passed","Mon May 13 19:14:25 GMT 2024","Mon May 13 19:14:34 GMT 2024","9036","","","","LoginTests","LoginWithShortPassword","LoginWithShortPassword","Check the error message if password is less than 5 characters"
"passed","Mon May 13 19:14:47 GMT 2024","Mon May 13 19:14:51 GMT 2024","4092","","","","HelperTests","DeleteAllMyProjects","DeleteAllMyProjects","Used to delete all my projects"
"passed","Mon May 13 19:14:37 GMT 2024","Mon May 13 19:14:47 GMT 2024","10060","","","","ProjectTests","DeleteAddedProject","DeleteAddedProject","Verifying an added project has been deleted"
